{
  "kind": "m3",
  "schema_version": 1,
  "timestamp": "2026-10-05T06:30:58.539810Z",
  "environment": {
    "scope": "Linux software-only development run: scripted ACP peer, fake SDK tree/preview worker and the engine's real controller (plus an installed SDK only when --real-sdk-active is given). Authentic gates need a real authenticated adapter, physical devices or other operating systems and are recorded separately.",
    "os": {
      "system": "Linux",
      "release": "6.8.0-142-generic",
      "version": "#142-Ubuntu SMP PREEMPT_DYNAMIC Wed Sep  2 14:24:27 UTC 2026",
      "machine": "x86_64",
      "distribution": "Ubuntu 24.04.2 LTS",
      "cpu_count": 16,
      "memory_kib": 32862284,
      "evidence_filesystem": {
        "mount_point": "/",
        "type": "ext4",
        "source": "/dev/vda2"
      }
    },
    "toolchain": {
      "rustc": "rustc 1.98.1 (48a229cea 2026-09-01)",
      "rustc_commit": "48a229ceaefd4985c50990b14116b6d856af0985",
      "host": "x86_64-unknown-linux-gnu",
      "cargo": "cargo 1.98.1 (797e8a9bc 2026-08-05)",
      "pinned_channel": "1.98.1",
      "xvfb": "/usr/bin/Xvfb",
      "xdotool": "/usr/bin/xdotool",
      "python": "3.12.3",
      "acp_sdk_crate": "2.2.0",
      "cargo_lock_sha256": "d9a63818ed10fdbdcf94b3515698d8b3f8cb2805ebd2ee5432b45f2ca6db3761"
    },
    "git": {
      "commit": "7767402dee255707acef4e772c4704a5e4cae172",
      "branch": "main",
      "dirty_paths": 95,
      "tree_fingerprint_sha256": "73722b75d22e609f86d55226821561005ca873ff990ec90d0e02f34a9049cc58",
      "fingerprint_note": "digest of `git diff HEAD` plus untracked files, excluding desktop/qualification"
    },
    "sdk": {
      "provided": true,
      "directory_name": "active",
      "sdk_id": "studio-sdk-x86_64-unknown-linux-gnu-v2",
      "fframes_version": "1.1.0",
      "cargo_fframes_version": "1.1.0",
      "target_triple": "x86_64-unknown-linux-gnu",
      "rust_toolchain": "1.98.1",
      "ffmpeg_tag": "9.0.0",
      "compatibility_sha256": "a7f79b086922a5100289a72cb2f630d6fe87ac0149d4dc7c1a0a672122b16425"
    },
    "adapter": {
      "requested_executable": "index.js",
      "executable_sha256": "4a1f0fff5cdd26b8c9adb5f9b3d314640e06f876cfff97cac437159b4551ec27",
      "launch_identity": "fb2e40c28192bc381dc372166813330c264df0e75e55526d8a208063edfe3366",
      "platform": {
        "system": "Linux",
        "machine": "x86_64"
      },
      "arguments": [],
      "resolved_executable_sha256": "4a1f0fff5cdd26b8c9adb5f9b3d314640e06f876cfff97cac437159b4551ec27",
      "agent_name": "@agentclientprotocol/claude-agent-acp",
      "agent_version": "0.85.1",
      "protocol_version": 1,
      "auth_methods": [],
      "auth_route": "adapter-managed sign-in (no environment variables forwarded)",
      "capabilities": {
        "load_session": true,
        "resume_session": true,
        "prompt_image": true,
        "prompt_audio": false,
        "prompt_embedded_context": true,
        "mcp_http": true,
        "mcp_sse": true,
        "mcp_stdio": true
      },
      "probe_status": "Ready",
      "fixture_detected": false
    },
    "harness": {
      "script": "desktop/scripts/qualify-m3-agent.py",
      "arguments": [
        "--ledger",
        "qualification/m3-results.json",
        "--out",
        "qualification/evidence/linux-m3-claude-20261005-132651",
        "--real-sdk-active",
        "<sdk-active>",
        "--adapter",
        "<tmp>/fframes-m3-claude-acp/node_modules/.bin/claude-agent-acp"
      ],
      "auth_env_names": [],
      "started": "2026-10-05T06:30:58.423419Z"
    }
  },
  "gates": {
    "dev_acp_transport": {
      "kind": "development",
      "status": "pass",
      "criteria": "ACP v1 driver tests (acp_v1, acp_v1_review) pass against the scripted peer: negotiation, streaming, permissions, cancellation, bounds, redaction.",
      "notes": "46 tests passed in 2 targets",
      "evidence": [
        {
          "path": "evidence/linux-m3-claude-20261005-132651/logs/acp_transport.log",
          "sha256": "58c2e687481a4bfea5144f70c06869032c12685355ac28b45fcae14519f48de9"
        },
        {
          "path": "evidence/linux-m3-claude-20261005-132651/environment.json",
          "sha256": "492f9dab0c809218ff21a1f9801456a1b12dd8ac3b751cf9bce5cec8c05f7173"
        },
        {
          "path": "evidence/linux-m3-claude-20261005-132651/harness-run.json",
          "sha256": "ba7538fb1fc142b128a932650d53e0132a9a59a65f45b74f5af0372dfee16288"
        }
      ]
    },
    "dev_engine_transactions": {
      "kind": "development",
      "status": "pass",
      "criteria": "Engine agent-task, candidate-validation, edit-transaction, promotion, history and crash-recovery suites pass.",
      "notes": "123 tests passed in 7 targets",
      "evidence": [
        {
          "path": "evidence/linux-m3-claude-20261005-132651/logs/engine_transactions.log",
          "sha256": "cda05ad187e86547e4440918188bd75f8d6c081930efd59584fbddca6d8a48b9"
        },
        {
          "path": "evidence/linux-m3-claude-20261005-132651/environment.json",
          "sha256": "492f9dab0c809218ff21a1f9801456a1b12dd8ac3b751cf9bce5cec8c05f7173"
        },
        {
          "path": "evidence/linux-m3-claude-20261005-132651/harness-run.json",
          "sha256": "ba7538fb1fc142b128a932650d53e0132a9a59a65f45b74f5af0372dfee16288"
        }
      ]
    },
    "dev_workflow_fixture": {
      "kind": "development",
      "status": "pass",
      "criteria": "The AgentWorkflow integration suite passes against the scripted peer, fake preview worker and real controller.",
      "notes": "64 tests passed in 1 targets",
      "evidence": [
        {
          "path": "evidence/linux-m3-claude-20261005-132651/logs/app_workflow.log",
          "sha256": "a98dc6e4310a87e1c4f1b444129ab32270d33ca8329f8300faf1178b5a10f30e"
        },
        {
          "path": "evidence/linux-m3-claude-20261005-132651/environment.json",
          "sha256": "492f9dab0c809218ff21a1f9801456a1b12dd8ac3b751cf9bce5cec8c05f7173"
        },
        {
          "path": "evidence/linux-m3-claude-20261005-132651/harness-run.json",
          "sha256": "ba7538fb1fc142b128a932650d53e0132a9a59a65f45b74f5af0372dfee16288"
        }
      ]
    },
    "dev_tools_and_validation": {
      "kind": "development",
      "status": "pass",
      "criteria": "Project tool broker/CLI/MCP, shared build service, candidate runner and preview handoff suites pass.",
      "notes": "102 tests passed in 4 targets",
      "evidence": [
        {
          "path": "evidence/linux-m3-claude-20261005-132651/logs/app_tools_validation.log",
          "sha256": "1c7e8384665cd1b17b4c16de2ad6ff0c94db234f014539aff204df8a7470747a"
        },
        {
          "path": "evidence/linux-m3-claude-20261005-132651/environment.json",
          "sha256": "492f9dab0c809218ff21a1f9801456a1b12dd8ac3b751cf9bce5cec8c05f7173"
        },
        {
          "path": "evidence/linux-m3-claude-20261005-132651/harness-run.json",
          "sha256": "ba7538fb1fc142b128a932650d53e0132a9a59a65f45b74f5af0372dfee16288"
        }
      ]
    },
    "dev_native_ui_workflow": {
      "kind": "development",
      "status": "pass",
      "criteria": "The native conversation panel / shell workflow test target (agent_workflow_ui: controls, permission and clarification cards, paging inside the resident limits, UI preview-handoff sink and acknowledgement) passes against the scripted peer.",
      "notes": "11 tests passed in 1 targets",
      "evidence": [
        {
          "path": "evidence/linux-m3-claude-20261005-132651/logs/app_ui_workflow.log",
          "sha256": "127b53fecd8afab3d4c6a6d66b91699f09b4dd9df49d1619cc35bee69e5676cb"
        },
        {
          "path": "evidence/linux-m3-claude-20261005-132651/environment.json",
          "sha256": "492f9dab0c809218ff21a1f9801456a1b12dd8ac3b751cf9bce5cec8c05f7173"
        },
        {
          "path": "evidence/linux-m3-claude-20261005-132651/harness-run.json",
          "sha256": "ba7538fb1fc142b128a932650d53e0132a9a59a65f45b74f5af0372dfee16288"
        }
      ]
    },
    "dev_native_x11_shell": {
      "kind": "development",
      "status": "pass",
      "criteria": "The production GPUI shell on an owned Xvfb (scripted peer, real SDK, software rendering) sends a prompt through native input after a baseline preview stepped to a non-zero playhead; the media-changing edit is adopted via adopt_promotion and displayed with matching video/audio revision and a changed audio digest, a fresh transport epoch, the playhead position/frame/PCM window retained and the awaiting label cleared; Undo restores the original audio through another matching hand-off under yet another epoch. Writer containment is the explicit test-only injection, not a qualification. NOT a provider, physical-display, physical-audio or IME qualification.",
      "notes": "1 tests passed in 1 targets",
      "evidence": [
        {
          "path": "evidence/linux-m3-claude-20261005-132651/logs/native_x11_shell.log",
          "sha256": "57a9dc54a28b6b503c6fd6c23df0064daaf9bdd05b8e72798b67e172795717bc"
        },
        {
          "path": "evidence/linux-m3-claude-20261005-132651/environment.json",
          "sha256": "492f9dab0c809218ff21a1f9801456a1b12dd8ac3b751cf9bce5cec8c05f7173"
        },
        {
          "path": "evidence/linux-m3-claude-20261005-132651/harness-run.json",
          "sha256": "ba7538fb1fc142b128a932650d53e0132a9a59a65f45b74f5af0372dfee16288"
        }
      ]
    },
    "dev_resource_bounds": {
      "kind": "development",
      "status": "pass",
      "criteria": "Under a long streamed transcript resident rows <= 400 and bytes <= 4 MiB (+ the newest row), older rows are paged, the 256-event queue never overflows and nothing is owned after close.",